Título,Fecha,Cuerpo,URL
Inauguraron el nuevo Centro de Operaciones Municipal de La Plata,2024-12-18,"Esta tarde, el intendente de La Plata, Julio Alak, y el gobernador de la provincia de Buenos Aires, Axel Kicillof, inauguraron hoy el nuevo Centro de Operaciones Municipal de la ciudad, que, bajo principios de orden, coordinación y eficiencia, centralizará funciones de distintas áreas que se encontraban distribuidas y atomizadas en seis sedes diferentes.
“Estamos recuperando el valor de un edificio fundacional, que unifica a partir de hoy las áreas de Seguridad, Control Urbano, Emergencias Territoriales, Patrullas Municipales y Central de Llamados”, anunció el jefe comunal durante el acto de presentación, del que participaron autoridades locales y bonaerenses, trabajadores y vecinos.
“Un centro operativo modelo, que será uno de los más modernos de la provincia y que nos permitirá mejorar la capacidad de respuesta del Municipio, a la vez que optimizará la calidad de las políticas desplegadas para prevenir la comisión de delitos y atender las emergencias”, continuó el jefe comunal, y enfatizó que “Una ciudad ordenada es la base del desarrollo”.
Por su parte, Kicillof expresó: “Como gobernador de la Provincia, estoy orgulloso de que se esté poniendo en el lugar que corresponde a la capital bonaerense, devolviéndole su brillo y esplendor”.
Asimismo, el Gobernador destacó la puesta en funcionamiento del Centro Administrativo Municipal y el Centro de Operaciones y Monitoreo y destacó: ""Hacía falta en la capital de la provincia de Buenos Aires, en la ciudad de La Plata, que hubiera un intendente que la conociera, que la amara y que viniera a transformarla como la está haciendo ahora Julio”. Y subrayó que “este centro de operaciones representará al cerebro de la ciudad”.
El COM estará equipado con tecnología de punta que hará posible el monitoreo y la coordinación del accionar de más de 900 cámaras, 100 patrulleros, 400 agentes de control urbano y otros recursos destinados a perfeccionar el accionar del Estado frente a la delincuencia, las emergencias e inconvenientes vinculados al ordenamiento urbano.
“La inauguración de este centro no es un hecho aislado, sino que representa un nuevo capítulo en el proceso de reconstrucción de la administración pública municipal con políticas públicas innovadoras que den respuestas efectivas a las problemáticas que nuestra ciudad atraviesa en este siglo XXI”, sostuvo Alak.
Cabe señalar que las áreas que ahora funcionarán en el COM no solo estaban físicamente distanciadas, sino también completamente descoordinadas, impidiendo la gestión de respuestas rápidas y adecuadas ante emergencias. Además, la sede de 20 y 50 se encontraba en muy malas condiciones, con oficinas en peligro de derrumbe, más de 2 mil motos abandonadas y otros objetos en desuso.
“En solo sesenta días logramos transformar un edificio ruinoso, en el corazón de la ciudad, en uno de los centros operativos municipales más grande de la provincia de Buenos Aires”, destacó el intendente platense, haciendo hincapié en la importante puesta en valor que se llevó adelante en el lugar, de donde se sacaron más de cien camiones de basura.
“El COM significa un cambio de paradigma en la manera en que se implementan las políticas de prevención y seguridad en la ciudad, que parte del concepto de integralidad. Constituye una herramienta de gestión inteligente para aportar mayor seguridad y tranquilidad a nuestros vecinos”, agregó el mandatario.
Finalmente, Alak subrayó: “La puesta en funcionamiento de este centro estratégico es un hito que nos reafirma el camino que hemos iniciado, con el apoyo de este gran gobernador, para rejerarquizar a la ciudad capital de La Plata”.
Vale recordar que, como parte de esta línea de gestión, semanas atrás también se inauguró el nuevo Centro Administrativo Municipal (CAM), que centralizó y simplificó 75 trámites que previamente se realizaban en ocho edificios y doce oficinas diferentes.
SEGURIDAD, ATENCIÓN TELEFÓNICA Y EMERGENCIAS CLIMÁTICAS
Trabajarán en el COM cerca de 140 operadores capacitados y especializados que monitorearán las más de 900 cámaras activas con las que cuenta la ciudad tras la incorporación de nuevos dispositivos que hizo posible la gestión del intendente Julio Alak.
Además, para promover el orden público se pondrá en funcionamiento un nuevo sistema más eficiente y centralizado que coordinará a los 400 agentes de Control Urbano encargados de realizar tareas de ordenamiento del tránsito, control vehicular y de cargas, seguridad vial, intervención en siniestros, habilitación al transporte de pasajeros e inspecciones industriales, comerciales y ambientales.
Asimismo, el playón será la sede de estacionamiento de las 100 nuevas patrullas con sistema de geolocalización recientemente incorporadas por la Comuna para realizar tareas de prevención con un despliegue más eficiente y coordinado. Esto representa una mejora significativa, considerando que en diciembre de 2023 la ciudad contaba apenas con 16 móviles en mal estado.
Por otra parte, la Central de Llamados nucleará a los tres call-centers que existen actualmente, incorporando un nuevo sistema informático que georreferenciará llamados y ofrecerá una respuesta eficiente a las solicitudes de los vecinos y las vecinas.
A su vez, el COM dispondrá de una nueva sala de estudio de imágenes que proveerá de información útil a la Administración de Justicia, el Ministerio Público Fiscal y las fuerzas de Seguridad para aportar a la labor judicial en la capital bonaerense, así como de un área de análisis criminal y de otra de prevención de delitos.
El nuevo polo integrará también al área de Emergencias Territoriales con el objetivo de prevenir y abordar distintos fenómenos hidrometeorológicos según lo que demanden los niveles de atención amarillo, naranja y rojo, realizando monitoreos para evaluar el riesgo en tiempo real en el marco del Plan de Reducción del Riesgo Hídrico elaborado por la UNLP.
CAPACITACIÓN DE PERSONAL Y EDUCACIÓN CIUDADANA
La inauguración del COM contempla capacitaciones en colaboración con el Gobierno bonaerense para contar con recursos humanos profesionalizados y actualizados a través de cursos en distintas materias, como, por ejemplo, ciberdelitos.
Al mismo tiempo, se trabajará en educación ciudadana, llevando talleres de educación vial a distintos ámbitos de la ciudad, como jardines y escuelas, y fomentando de esa manera el conocimiento y el respeto de las normas que ordenan la vida en comunidad.
UN TRABAJO POR ETAPAS
En esta primera etapa, todas las áreas de operaciones municipales quedarán centralizadas para alcanzar una mayor eficiencia operativa en la ciudad.
Próximamente, la Municipalidad duplicará el número de cámaras activas hasta superar las 2 mil, incorporando tecnología analítica, que, combinada con inteligencia artificial, permitirá resolver hechos con mayor eficacia.
Además, la gestión de Alak instalará un anillo digital para controlar el ingreso y el egreso de vehículos en 50 de los principales accesos y la circulación en las principales avenidas de la ciudad a través de 100 lectoras de patentes.",https://eleditorplatense.com/pol%C3%ADtica/17/2024/12/18/inauguraron-el-nuevo-centro-de-operaciones-municipal-de-la-plata
Sequía climática y económica en el cordón hortícola platense,2024-11-26,"La Administración Nacional Oceánica y Atmosférica (NOAA) de Estados Unidos emitió una alerta para el territorio argentino por la llegada del poderoso fenómeno atmosférico ‘La Niña’ durante el verano 2025, ocasionando un periodo estival con muy pocas precipitaciones que podrían desencadenar en una profunda sequía en el centro del país. Desde el cordón flori-fruto-hortícola de La Plata advierten por el cóctel explosivo que podría ocasionar si se suma a la crisis económica que afrontan los productores y que ya generó la ida de un frondoso número de familias agrícolas. 
De acuerdo a los reportes meteorológicos que llegan desde Norteamérica, la llegada de La Niña había sido prevista para 2024 y se estimaba un 60% de probabilidades de que arribará a suelo argentino a mitad de año. Sin embargo, se retrasó y hoy las chances son aún más elevadas de que su arribo se dé entre enero y marzo de 2025 y afecte -principalmente- al centro y norte del país.
En el cordón productivo de la región ya se hicieron eco del posible golpe climático sobre la cosecha 2025. “Lamentablemente nos va a tocar ver a cuantos nos deja sin producción”, afirmó tajante la referente de la Asociación de Medieros y Afines (ASOMA), Albina Vides. La falta de lluvias que anticipan en el cinturón verde afectaría directamente la napa y, consecuentemente, a los sistemas de abastecimiento de agua. Al no haber agua de lluvia, el nivel de la napa desciende paulatinamente por lo que se deben realizar perforaciones más profundas -y costosas- para extraer con la bomba. Un escenario imposible para los productores. 
Pero la situación es aún más compleja. Si bien el territorio argentino aún no está bajo los efectos de ‘La Niña’, los productores padecen la falta de agua por los reiterados cortes de luz que dispone la empresa suministradora. “Ya venimos sufriendo los cortes de luz. A veces cortan el servicio por 24 horas sin dar ninguna explicación y nosotros no podemos usar las bombas para sacar agua”, expresó Isabel Palomo, reconocida productora de tomate de la localidad de El Peligro. Y sumó: “Es perjudicial porque por ahí está la gente plantando y te dejan sin luz, no los regas y se muere el plantín”. 
Los productores utilizan bombas con conexión trifásica para poder abastecer quintas que ocupan -en promedio- entre una y tres hectáreas con plantaciones a cielo abierto e invernáculos, donde la temperatura suele duplicarse en su interior por lo que el riego es vital para evitar que se seque la planta. 
“No tenemos la posibilidad de poder trabajar como para poder tener un reservorio, por ejemplo, que nos permita en situaciones como esta contar con agua para riego. Sería un sistema ideal para intentar, al menos, salvar algo”, reclamó Vides. Desde el sector productivo mantienen diálogo con las autoridades, a quienes advirtieron la necesidad de implementar medidas para morigerar el impacto de la crisis ambiental. 
“La principal y peor de las peores sequía son las políticas del Gobierno nacional que está expulsando a muchos productores por los costos que hoy se requieren para poder seguir produciendo desde los insumos, la luz y el alquiler”, advirtió 
Sequía económica
Los tarifazos que se aplicaron a lo largo del año, el incremento de los insumos, las facilidades otorgadas desde Casa Rosada a las importaciones y el desplome del consumo interno forman una mezcla dañina para los productores locales, en la antesala a los sacudones climáticos que se prevé. 
“Las boletas de luz que están llegando son una locura. ¿Cómo puede pagar un productor un millón de pesos una boleta cuando antes pagaban 50 o 100 mil pesos como mucho en verano? Todavía no estamos en pleno verano y ya están llegando boletas con esos valores. Es un problema grave”, precisó Palomo. 
A este gasto se le suma el alquiler de la tierra que afecta a gran parte de los productores: en apenas un puñado de meses aumentó hasta seis veces el valor del arrendamiento. El salto en el precio de los insumos como la semilla o los plásticos es otra de las variables que registraron un alza en los últimos meses, mientras que el consumo se desplomó catapultado por la suba en las verdulerías. 
“Hay un gran problema con el tema del consumo, la gente no tiene plata en el bolsillo para poder comprar la verdura que nosotros producimos, que es todo para el mercado interno”, indicaron. 
Asimismo, advierten que un factor que también jugará esta temporada es el ingreso desde Chile, Brasil y Paraguay de verduras que se producen en territorio platense durante la temporada. “Vamos a ver tomates, zapallito, berenjena, pepino tirado por todos lados, como ya se está viendo ahora. La principal preocupación es cuando sea el grueso de la temporada de cosecha”, selló. 
Todo esta combinación de factores negativos siembran incógnitas en el cordón hortícola del Gran La Plata que se prepara para afrontar un verano con sequía climática y económica.",https://eleditorplatense.com/la%20regi%C3%B3n/21/2024/11/26/sequia-climatica-y-economica-en-el-cordon-horticola-platense
Indec publica la inflación de noviembre: expectativa tras el discurso de Milei,2024-12-11,"El Instituto Nacional de Estadísticas y Censo (Indec) publicará esta tarde la inflación del mes de noviembre, un dato clave tras el discurso del presidente Javier Milei que anticipó que el 2025 será “un año de baja inflación”. Desde el Gobierno esperan que el índice se ubique en torno al 2,5% en los últimos dos meses del año.
Según el Relevamiento de Expectativas del Mercado (REM) que publica el Banco Central de la República Argentina (BCRA), que surge de la opinión de 29 consultoras y 13 entidades financieras, la inflación de noviembre va a alcanzar el 2,8%. Es decir, una décima porcentual menos de lo que marcó en octubre.
Otro dato fuerte a la hora de intentar anticipar el porcentaje inflacionario es la variación de precios que publica el Gobierno de la Ciudad de Buenos Aires: en noviembre fue del 3,2%. En tanto, en el caso de La Plata la inflación se ubicó en torno al 2,7% y los analistas anticiparon que afronta un periodo de estabilidad, aunque advierten que en los últimos dos meses es difícil que se registre una pausa en el proceso de desinflación, el que podría retomarse ya en 2025.
Según la consultora Analytica, la inflación del anteúltimo mes del año será del 2,7%, número que estaría explicado por los precios del gas, luz, agua y nafta. Sin embargo, desde EcoGo Consultores se estimó que la inflación será del 3,2%.
En cuanto a Invecq, manifestaron que la inflación del décimo primer més será de 2,5% con un aumento en bebidas y alimentos que ""podrían elevar el pronóstico de inflación general para el cierre del mes"".
Libertad y Progreso aeguró que la inflación cerrará en 2,9%. Su director, Aldo Abram, ratificó que ""sigue siendo una desaceleración"" porque ""por lo general y debido a la estacionalidad"" los meses de octubre ""suelen tener cifras más bajas"" que los de septiembre y noviembre.
Ayer, el presidente Javier Milei dijo que “estamos cada día más cerca de que la inflación sea poco más que un mal recuerdo” y anticipó un 2025 con cifras bajas. “Estamos entrando a un año de baja inflación, alto crecimiento económico y, en consecuencia, un crecimiento sostenido del poder adquisitivo de los argentinos, algo que hace décadas los argentinos no viven”, subrayó.",https://eleditorplatense.com/econom%C3%ADa/21/2024/12/11/indec-publica-la-inflacion-de-noviembre-expectativa-tras-el-discurso-de-milei
"Recaudaron el dinero y repatriarán el cuerpo de Abril Montero, la hija de la ""Estatua viviente"" de La Plata",2024-12-18,"El cuerpo de Abril Muriel Montero (25), hija de Sergio ""Pachuli"" Montero, más conocido como ""La Estatua Viviente"" será finalmente repatriado a La Plata. Fue su hermana, Bic Montero, quien luego de intensas gestiones, y varias campañas de solidaridad, finalmente logró una recaudación en tiempo record y se ocupó de todos los gastos.
Según informó la propia hermana de Abril, el traslado se hará esta misma noche o mañana jueves. Asimismo, trascendió que sus restos serán velados el próximo viernes en la casa velatoria Galliano E Hijos, ubicada en 53 entre 18 y 19, aunque el horario aún no está confirmado.
En tanto por estas horas también se supo que el caso de Abril ahora está bajo la tutela del abogado Fernando Burlando. Tal como informó El Editor Platense anteriormente, desde el entorno de la ""Estatua viviente"" aseguran que se trató de un femicidio, aunque al momento trascendieron pocos detalles sobre el hecho. Lo cierto es que Abril Montero había llegado al país cafetero hace unos dos meses, procedente de Ecuador.",https://eleditorplatense.com/policiales/1/2024/12/18/el-cuerpo-de-la-hija-fallecida-de-la-estatua-viviente-ya-se-encuentra-en-la-plata
"Con más de 25 talleres disponibles, abrió la inscripción para la Colonia de Arte 2025",2024-12-18,"Para quienes tengan pensado quedarse en la ciudad durante el verano, la Colonia de Arte 2025 es una gran actividad para disfrutar y aprender sobre diferentes disciplinas. El espacio propone una gran variedad de talleres destinados a niños, jóvenes y adultos en distintos barrios y centros culturales de La Plata. 
Los talleres se desarrollarán en Tolosa, San Carlos, Altos de San Lorenzo, Los Hornos y Sicardi, además del Centro Cultural Pasaje Dardo Rocha, Centro Cultural y de la Memoria Islas Malvinas, Centro Cultural Julio López y Polideportivo Los Hornos. Los vecinos podrán inscribirse de manera presencial en cada una de las sedes antes del comienzo de clases que tendrá lugar el próximo lunes 6 de enero. 
La propuesta incluye clases de dibujo, plástica, cerámica, música, teatro, danzas, barbería, manicura, máscaras y cómic, entre otros. La información detallada se encuentra disponible en su perfil de Instagram @escuelatallerlp y @laplata.ciudadcultural. Quienes quieran conocer más detalles, pueden comunicarse vía mail a escuelatallerlp@gmail.com o por teléfono al 221 425 2101. 
View post on Instagram
“Esta propuesta busca acercar el arte y la cultura a toda la comunidad platense, ofreciendo espacios de aprendizaje y expresión artística”, expresaron desde la Escuela Taller Municipal de Arte.",https://eleditorplatense.com/la%20regi%C3%B3n/19/2024/12/18/con-mas-de-25-talleres-disponibles-abrio-la-inscripcion-para-la-colonia-de-arte-2025
El mapa del Concejo Deliberante camino a un año de reconfiguración,2024-12-17,"Con el tratamiento del Presupuesto 2025 consumado y la discusión por el nuevo Defensor Ciudadano de La Plata en desarrollo, el Concejo Deliberante se prepara para iniciar el camino a un año electoral en el que se renovarán la mitad de las bancas. Los 12 ediles que mantienen su escaño desde 2021 ya afrontan su último año legislativo y crecen las expectativas por la definición sobre quienes buscarán un nuevo mandato y los que dejarán la silla. El PRO y la incógnita Julio Garro, la apuesta de los radicales a competir con nombres propios, el desafío oficialista de consolidar la mayoría en el cuerpo y el avance liberal. 
En Unión por la Patria son cinco ediles los que inician el último año en el hemiciclo de calle 11. Los concejales del riñón de Victoria Tolosa Paz, Cintia Mansilla y Juan Manuel Granillo Fernández, son dos que pondrán en juego la banca en 2025, tras haber ingresado al Concejo Deliberante en las elecciones de medio término de 2021 como segundo y quinto concejal. 
A lo largo de los cuatro años ambos se consolidaron como referentes dentro del hemiciclo con foco en la agenda de los sectores productivos de la zona oeste, donde la diputada nacional busca consolidar su armado local. En 2025, VTP buscará imponer algunos nombres propios entre los candidatos al Deliberante y -a priori- no se descarta que ambos puedan ir por un nuevo mandato, aunque desde el sector insisten que “no es tiempo de discusión de candidatura”. 
Los ediles Cristian Vander, del Sindicato de Telefónicos; Yanina Sánchez, representante de la CTA; y Julio Cuenca, del gremio que nuclea a los pasteleros, también afrontan los últimos meses en los escaños que ocupan por la partida al Ejecutivo de Luis Arias (Secretario de Coordinación), Ana Negrete (Secretaria de Cultura) y Guillermo Escudero (Secretario de Ambiente). Los tres representantes del gremialismo, que ingresaron al Concejo en diciembre del 2021, empezaron a ganar terreno con una agenda propia centrada en los trabajadores en medio de un contexto adverso a nivel nacional. 
Hoy, Unión por la Patria tiene la primera minoría con 10 concejales y necesita de la oposición para juntar las 13 voluntades para garantizar quórum y avanzar con proyectos propios. El próximo año el oficialismo tiene el desafío de ir en búsqueda de incorporar algún representante más para allanar un terreno que le facilite avanzar con iniciativas propias en los últimos dos años de la gestión de Alak sin estar -demasiado- atado a la negociación con la oposición. 
La oposición
El radicalismo y el PRO también verán partir algunas casas, en caso de no renovar. Dentro del espacio boina blanca deberán dejar sus bancas Diego Rovella, Manuela Forneris y Javier Mor Roig, quien tuvo un intervalo tras tomarse licencia para asumir como parte del directorio de la Autoridad del Agua (ADA). 
Para la UCR será una votación clave ya que, si no renueva ninguna banca, podría tener un solo representante en el Concejo a partir de 2026. Además, el comicio marcará el termómetro de una carrera electoral con vistas a un 2027 en el que el espacio boina blanca que conduce Pablo Nicoletti pretende competir por la intendencia con un nombre propio, aunque primero tiene que resolver la cruda interna que hay en el partido centenario. 
El último viernes Nicoletti asumió junto a Luciana Bártoli su segundo mandato al frente de la Junta Central tras ganarle los comicios al espacio que se encolumna detrás del senador nacional Maximiliano Abad, con quien el platense se cruzó en reiteradas oportunidades. En las últimas horas, el representante local “abadista”, Raúl “Turco” Cadaá, cargó de lleno contra el binomio al que acusó de no contar con el respaldo suficiente para iniciar su nueva gestión. Además, desde el sector dejaron trascender un posible acuerdo con el oficialismo local de cara al próximo año. El respaldo radical a proyectos peronistas fue uno de los puntos más cuestionados por parte de la oposición dura en el Concejo Deliberante. 
Por último, en el PRO afrontan su último año de mandato los ediles Juan Manuel Martínez Garmendia (actual presidente del bloque), Lucas Lascours, y Lucia Barbier. En el futuro de estos será clave el rol que pueda tomar Julio Garro, ya que los tres ediles son de su riñón. Tras su fugaz paso por el Ejecutivo nacional que terminó con una salida envuelta en escándalo, el exintendente volvió a meterse en la disputa local tras bambalinas y será el que tenga la lapicera con más tinta el próximo año. 
Hoy, la duda pasa por la postura que adopte respecto al liberalismo en medio de un momento de extrema tensión entre Mauricio Macri -referente político del platense- y Javier Milei. Dentro del Concejo Deliberante, el PRO está dividido entre aquellos más lejanos a las ideas violetas y quienes decidieron comulgar con ellas. María Belén Muñoz, quien compone el monobloque Pro Libertad y deja su banca el próximo año, decidió romper con el resto de los ediles con los que llegó en 2021 por la boleta de Juntos por el Cambio. 
En tanto, dentro del bloque amarillo está Nicolás Morzone que a nivel país se encolumnó detrás de Patricia Bullrich y Milei, lo que desencadenó en cortocircuitos internos como el que ocurrió durante el tratamiento del Presupuesto 2025 en el que el abogado votó en contra al igual que LLA, mientras sus compañeros acompañaron el proyecto. 
Por ahora, no hay un horizonte claro sobre el futuro del Concejo Deliberante a días del inicio de un año que, a priori, parece que se vendrá con mucha temperatura.",https://eleditorplatense.com/pol%C3%ADtica/21/2024/12/17/el-mapa-del-concejo-deliberante-camino-a-un-ano-de-reconfiguracion
