Título,Fecha,Cuerpo,URL
A partir de los 18 años se podrá tener un arma en el país,2024-12-17,"A través de un decreto, el Gobierno nacional estableció que los ciudadanos argentinos mayores de 18 años podrán ser considerados legítimos usuarios de armas. Esta decisión, que actualiza una norma de 1975, fue hecha en consonancia con la reforma del Código Civil de 2009, en la que se estableció la mayoría de edad en los 18 años. 
La modificación responde a un cambio de enfoque sobre la edad adulta y los derechos inherentes a la misma, porque, según argumentó la ministra de Seguridad, Patricia Bullrich, “a los 16 años los argentinos ya tienen el derecho de votar; a los 18, pueden ir a la guerra, formar una familia o incluso ser miembros de una fuerza de seguridad. Además, pueden optar por un cambio de sexo, que los marcará de por vida”. Frente a esto, planteó la pregunta de “¿por qué no permitirles también ser legítimos usuarios o portadores de armas?”.
""Durante años, nadie se animó a tomar esta decisión. Nosotros no dudamos"", afirmó la Ministra, haciendo énfasis en la necesidad de actualizar las leyes acorde a la realidad actual. En esa línea, indicó que esto se da en el mismo momento que “desmantelamos las bandas narcoterroristas y enfrentamos al crimen organizado”, por lo que “los ciudadanos de bien deben poder acceder a las armas para protegerse"".
Desde el Ejecutivo destacaron que esta medida responde al compromiso de “hacer realidad el derecho de los argentinos a vivir en libertad y garantizar su seguridad"". Con esta normativa, el Gobierno busca equilibrar la necesidad de protección personal con la lucha contra el crimen organizado, ofreciendo a los ciudadanos mayores de 18 años la posibilidad de acceder a las armas, dentro del marco de la legalidad y conservando el respeto por la seguridad pública.
Cabe recordar que anteriormente la obtención de la Credencial de Legítimo Usuario (CLU) se podía tramitar a partir de los 21 años. Se trata del primer paso para luego solicitar la tenencia de un arma que permite tenerla en el domicilio, transportarla descargada y usarla para fines como caza o tiro deportivo en lugares autorizados. También mantiene la obligación de contar con una ficha limpia, por lo que los ciudadanos no podrán comprar un arma si tienen antecedentes penales.
Esta medida no afecta a la portación de las mismas, la cual permite llevarla cargada y lista para usar en un lugar público, uso exclusivo para los miembros de las Fuerzas Armadas y de Seguridad, ya que el decreto no aclaró nada distinto al respecto. El artículo en cuestión establece además una serie de requisitos que se deben cumplir para la portación de armas, como el no tener “anormalidades psíquicas o físicas que incapaciten al peticionante”, la acreditación de datos personales bajo dependencia policial, y “la no existencia de antecedentes policiales o penales”.
Es importante mencionar que no se podrá acceder a un arma de un día para el otro, pero sí se simplificarán los trámites. Van a tener que obtener primero el CLU, después, van a poder ir a comprar un arma y ahí le van a dar la tenencia. Además, para circular tendrán que hacerlo con el certificado que indica qué arma se adquirió. Desde la cartera de Seguridad hicieron énfasis en la necesidad de actualizar el régimen de trámites para poder “tener un registro de armas transparente, completo y con procesos modernos”, debido a que se estima que en la actualidad hay más de 800.000 armas de fuego bajo tenencia irregular. 
Otro punto que se establece es la extensión por cuatro años del Programa Nacional de Entrega Voluntaria de Armas de Fuego, con el objetivo de que las personas puedan entregar las suyas de forma voluntaria y anónima para que sean destruidas. Con esto, se protege a los usuarios de tener futuros problemas legales por no tener las autorizaciones pertinentes. 
Estas medidas generaron opiniones cruzadas entre la ciudadanía, desde posiciones a favor ante la crecida de la inseguridad y la necesidad de defenderse, hasta comunicados que expresan que este decreto es un peligro para la población. Desde la Facultad de Ciencias Sociales de la UNICEN, se pararon de ese lado, advirtiendo que según estadísticas del Ministerio de Salud de la Nación, anualmente se registran en nuestro país cerca de 3000 muertes y más de 10.000 heridos por las armas de fuego, y sobre ello, mencionaron que “la mayoría de los que matan y mueren son varones jóvenes de entre 15 y 30 años y el 75% se producen en situaciones de conflictos interpersonales, accidentes y suicidios”.  
Por lo tanto, alertaron: “Estas cifras podrían incrementarse a partir del decreto aprobado por el Gobierno nacional que desconoce el impacto letal que contiene”. Además, sostuvieron que el argumento de que la mayoría de edad es suficiente para habilitar el acceso a las armas de fuego es “falaz y carece de fundamento serio”.
Martín Angerosa, miembro cofundador de la Red Argentina para el Desarme e integrante del Instituto Latinoamericano de Seguridad y Democracia (Ilsed), por otro lado, también mostró su preocupación con esta disposición, al expresar que puede incrementar “el riesgo de suicidios en un sector etario particularmente vulnerable, ya que el 30% de los que ocurren en jóvenes de 18 a 24 años son con armas de fuego”.
“Son muertes evitables, y esta medida sólo amplía las posibilidades de tragedias que podrían prevenirse”, destacó y consideró que se está abriendo “el mercado legal a 1.500.000 potenciales compradores jóvenes, pero el verdadero beneficiado es el negocio por detrás: fabricantes y comerciantes de armas. En este mercado hay ganadores y perdedores, y los perdedores son los jóvenes”.
Por último, Angerosa habló de la necesidad de que el Estado sea responsable en este tema porque “la sociedad argentina no quiere vivir en un país armado. No queremos ser responsables de nuestra propia seguridad; para eso están los profesionales que pagamos con impuestos”.",https://eleditorplatense.com/pol%C3%ADtica/1/2024/12/17/a-partir-de-los-18-anos-se-podra-tener-un-arma-en-el-pais
Más nublado imposible: días de calor y con poco Sol en La Plata,2024-12-18,"Quedan pocos días para el inicio del verano, el calor cada vez se hace más presente en La Plata y la región y es costumbre que las temperaturas estén promediando los 25 a 30 grados cada día. Sin embargo, este miércoles y durante algunos días más el Sol no será tan protagonista como las nubes.
El Servicio Meteorológico Nacional indicó que para hoy la mínima es de 17 grados y máxima de 30, con condiciones de cielo nublado salvo algunas horas en la mañana.
Jueves de entre 20 a 30°, similar al miércoles; viernes de 22 a 30. Recién el domingo estará en parte más despejado, llegando a los 28°.",https://eleditorplatense.com/la%20regi%C3%B3n/11/2024/12/18/mas-nublado-imposible-dias-de-calor-y-con-poco-sol-en-la-plata
Las ventas en supermercado siguen en caída,2024-11-26,"El INDEC difundió datos sobre las ventas en supermercados, las cuales expresaron que sufrieron una caída de 12,8% interanual, además de haber bajado un 11,6% desde enero de este año.
En ese sentido, se ve reflejada la caída del poder adquisitivo en el país, teniendo a los supermercados y autoservicios en constante baja. Este último, en ventas totales muestra una disminución de 21,7% respecto de igual mes de 2023, y el acumulado enero-septiembre bajó 14,4%.
En esta caída se puede ver que las ventas totales en el último mes analizado sumaron 1.585.347,2 millones de pesos, lo que representa un incremento de 173,3% respecto al mismo mes del año anterior. De los cuales “Artículos de limpieza y perfumería”, sufrió un aumento de 216,5%; Verdulería y frutería subió 202,2%; Lácteos un 199,4%; y “Panadería” un 191,4%. Y otro punto a tener en cuenta es que las compras efectuadas con tarjeta de débito sumaron 425.958.250 miles de pesos, lo que representa el 26,9% de las ventas totales, mientras que las de crédito sumaron un total de 718.252.690 miles de pesos, lo que representa el 45,3%
En cuanto a los electrodomésticos, la ventas a precios corrientes del tercer trimestre de 2024 totalizaron 1.119.144 millones de pesos y muestra una variación positiva de 190,9% respecto al mismo trimestre del año anterior.
Sin embargo, hubo fuertes caídas del 30,3% en telefonía celular, 27,8% en pequeños electrodomésticos, del 13,7% en MP3 y iPod, 13,1% en televisores y 10,9% en cocinas y microondas.",https://eleditorplatense.com/econom%C3%ADa/150/2024/11/26/las-ventas-en-supermercado-siguen-en-caida
Avanzaron con el cierre de cruces en San Carlos,2024-12-18,"En las últimas horas, vecinos de San Carlos se vieron sorprendidos por la gran cantidad de cruces cerrados que avanzó la Comuna en el barrio para mejorar la onda verde desde la avenida 44 y 31 hasta la Ruta 2.
Todo comenzó hace algunos días, donde los vecinos de Etcheverry también se vieron molestos por la gran cantidad de cierre de cruces que hubo en la zona oeste platense. En tanto, la Municipalidad avanzó esta semana en la localidad de San Carlos, cerrando los cruces en la avenida 44 y 133; 44 y 135; 44 y 145; y 44 147 . Todos estos cambios serían para mejorar el tránsito para ingresar y salir de la ciudad de La Plata, informaron de forma oficial.
En declaraciones que hizo un vecino a este medio, contó: ""La verdad que complica mucho para los que somos de barrio porque no vamos a poder cruzar y tendríamos que irnos hasta otra avenida para hacer los mandados"". 
Cabe recordar que la implementación de la onda verde contempla cerrar el girar los cruces en todas las zonas donde no haya intersección entre dos avenidas. Es decir, solo se podría girar a la izquierda o cruzar la avenida 44 desde alguna avenida como la 131, 143, 155, entre otras. También se mantendrán los semáforos para permitir el cruce en otras zonas de alto tránsito.
LOS VECINOS DE ETCHEVERRY SE VIERON MOLESTOS POR LA DECISIÓN
Tras los reclamos del viernes, los vecinos de la localidad de Ángel Etcheverry se reunirán esta tarde con autoridades de la Municipalidad de La Plata para definir el futuro de dos cruces en la avenida 44 que la Comuna pretende cerrar en el marco de implementación de la onda verde.
“Si cierran los giros solo se podrá doblar en los semáforos, pero cada 15 cuadras hay uno. En esta zona transitan muchos camiones que tienen que ingresar a las calles y no hay lugares para dar vuelta con esta medida. Tampoco hay calles de asfalto para ingresar hacia adentro”, precisaron los vecinos en diálogo con El Editor Platense el pasado viernes tras advertir que la Comuna inició las obras para cerrar los cruces de la avenida 44 a la altura de calle 220 y calle 232.
En la zona de Etcheverry más cercana al cruce con Ruta 2 precisaron que si solo queda libre el giro en calle 229, en caso de que se produzca una interrupción del mismo por accidente u otro episodio, no se podrá acceder a múltiples puntos de la localidad debido a que no habría otras vías de acceso.
Según precisaron los frentistas, desde la delegación comunal anticiparon que ambos cruces se mantendrán abierto. En tanto, desde la Comuna consideraron que “se está analizando” esa posibilidad.
Por otro lado, los vecinos de Lisandro Olmos se manifestaron en contra de la posible erradicación del semáforo de calle 200, una arteria transitada a diario por los vecinos ya que es el principal acceso a una de las escuelas de la zona. “Sería una complicación también para los chicos que van en micro y tienen que cruzar una avenida sin semáforo”, advirtieron.",https://eleditorplatense.com/la%20regi%C3%B3n/17/2024/12/18/avanzaron-con-el-cierre-de-cruces-en-san-carlos
Esperan una inflación del 50% para los próximos 12 meses,2024-11-28,"Según un informe realizado por la Universidad Di Tella, la inflación esperada por la población para los próximos 12 meses es de 50,2%.
 “Los hogares de menores ingresos son los que tienen menor expectativa de inflación para los próximos 12 meses (49,3%). Por su parte, los hogares de ingresos altos también registran una caída en sus expectativas pasando de 55,6% en octubre a 50,6% este mes”, señaló Sebastián Auguste, Director del Centro de Investigación de Finanzas de la casa de estudios.
El directivo indicó que “para la inflación mensual, en noviembre los hogares esperan un valor de 5,21% según la media (4% según la mediana), cuando en octubre fue de 5,43% (5% según la mediana).""
Según este estudio, “la inflación esperada promedio de 50,2% es el nivel más bajo desde octubre de 2021, mientras que la mediana se mantiene en 40%”.  En comparación, en octubre, el promedio había sido del 54,5%.
Por regiones, el Interior reporta las expectativas de inflación anual más bajas con 46,8%, seguido por CABA con 53,8% y GBA con 55,4%. Los valores de las tres regiones son menores en comparación con octubre (51,8%, 61% y 57,7% respectivamente).",https://eleditorplatense.com/econom%C3%ADa/1/2024/11/28/esperan-una-inflacion-del-50-para-los-proximos-12-meses
Empresarios de micros protestan en La Plata y amenazan con aumentar el boleto,2024-12-18,"Las Cámaras de Transporte Público de la provincia de Buenos Aires volvieron a concentrarse hoy en las inmediaciones de la Casa de Gobierno bonaerense para reclamar por la demora en el pago de subsidios que garantizan el funcionamiento del sistema y piden una nueva estructura de costos. Amenazan con aumentar el boleto. 
Una semana después de la movilización de colectivos en la puerta de Gobernación, los representantes de las cámaras empresariales retomaron la protesta y fueron recibidos por el ministro de Transporte bonaerense, Jorge D’Onofrio. 
Los privados reclaman que los subsidios que perciben del estado nacional “no alcanzan” y los pagos “no se cumplen en tiempo y forma”. Según lo denunciado, la deuda acumulada asciende a 28 mil millones de pesos e incluye parte de los montos adeudados desde mayo hasta diciembre. 
Ante la falta de respuestas de la Casa Rosada, el sector empresarial se movilizó a calle 6 para pedir que se agilice el auxilio estatal o se habilite la reestructuración del cuadro de costos. 
De acuerdo al “Índice Bondi” de la Asociación Argentina de Empresas de Transporte Automotor (AAETA), el costo por pasajero se ubicaba en octubre en $1.319,7, un 30% más que lo cubierto por el Estado. En consecuencia, las compañías reclaman que incrementen el valor del boleto para compensar la balanza sino no podrán garantizar el normal funcionamiento del servicio.",https://eleditorplatense.com/la%20regi%C3%B3n/1/2024/12/18/empresarios-de-micros-protestan-en-la-plata-y-amenazan-con-aumentar-el-boleto
Paro de trenes: el Gobierno dictó la conciliación obligatoria,2024-12-17,"La Secretaría de Trabajo dictó la conciliación obligatoria por dos semanas y este miércoles finalmente no habrá paro de trenes. Así lo comunicó el Ministerio de Capital Humano, desde donde publicaron un texto anunciando la medida.
Como bien había informado El Editor Platense, el sindicato La Fraternidad había llamado a un paro de 24 horas para este 18 de diciembre, debido a desacuerdos en las negociaciones salariales. La medida de fuerza afectaba a todos los ramales nacionales desde la medianoche hasta las 00.
Cabe recordar que el conflicto había iniciado cuando se determinó un reajuste de los salarios de los trabajadores ferroviarios del 1% par noviembre y del 2,5% para diciembre. Además, desde el sindicato aseguraban que esto significaba una pérdida del poder adquisitivo y que no compensaba los valores de la inflación.",https://eleditorplatense.com/pol%C3%ADtica/1/2024/12/17/paro-de-trenes-el-gobierno-dicto-la-conciliacion-obligatoria
Aumenta el saldo negativo de la SUBE: ¿de cuánto será?,2024-12-18,"El Gobierno nacional anunció que a partir de hoy aumenta el saldo de emergencia en la tarjeta SUBE y el valor del plástico en los puntos de venta habilitados. Además, anunciaron la continuidad de la tarifa social. 
Desde este miércoles 18 de diciembre, el usuario podrá tener hasta -1.200 pesos en colectivos de la provincia de Buenos Aires, subtes de la Ciudad de Buenos Aires y transporte fluvial en el Delta de la Provincia de Buenos Aires. 
En tanto, el saldo negativo en los trenes del Área Metropolitana de Buenos Aires (AMBA), que incluye la línea Roca que une La Plata con la Estación Plaza Constitución, será de -650 pesos. 
Por otro lado, anunciaron que el valor de la tarjeta SUBE física será de $1.500 en los puntos de venta habilitados y que seguirá vigente la Tarifa Social Federal para que los grupos beneficiarios viajen con 55% de descuento. Este beneficio está dirigido a Jubilados y/o pensionados, Personal del Trabajo Doméstico, Veteranos de la Guerra de Malvinas y Monotributistas Sociales .
También quienes perciben la Asignación Universal por Hijo, Asignación por Embarazo. Programa de Jóvenes con Más y Mejor trabajo, Seguro por desempleo, Seguro de Capacitación y Empleo, Programa Promover Igualdad de Oportunidades, Programa PROGRESAR, Programa Volver al Trabajo, Programa Acompañamiento Social y Pensiones No Contributivas.
¿Cómo cargar tu SUBE?
La carga de la tarjeta puede realizarse de manera presencial en los puntos habilitados o electrónicamente, a través de la app SUBE, cajeros automáticos, homebanking o billeteras virtuales. En caso de elegir una carga electrónica, es necesario acreditar el saldo en la tarjeta utilizando la app SUBE, las Terminales Automáticas o la opción Carga a Bordo en las validadoras de los colectivos.",https://eleditorplatense.com/la%20regi%C3%B3n/21/2024/12/18/aumenta-el-saldo-negativo-de-la-sube-de-cuanto-sera
Provincia recibe a los gremios para discutir la última mejora salarial del año,2024-12-17,"El Gobierno de la provincia de Buenos Aires recibirá hoy a los gremios que nuclean a los estatales bonaerenses para discutir una mejora salarial del último mes del año. Si bien se desconoce si la administración bonaerense oficializará alguna propuesta, se espera que ambas partes avancen con la discusión sobre el sendero salarial del 2025. 
A partir de las 10:30 horas, las autoridades del Gobierno bonaerense recibirán a los gremios de los docentes nucleados en el Frente de Unidad Docente Bonaerense (FUDB), mientras que en horas del mediodía será el turno de los estatales bonaerenses. 
Desde calle 6 ya expresaron a los gremios que afrontan un “estado complejo” en las finanzas públicas a causa de una caída de recursos en términos reales, aunque garantizaron el pago del salario de diciembre y el medio aguinaldo en tiempo y forma. 
No obstante, desde los sindicatos anticiparon que la intención es cerrar el año con un nuevo aumento con el objetivo de “seguir recuperando el poder adquisitivo de los salarios, entendiendo el contexto nacional conflictivo”. 
Cabe recordar que el último acuerdo paritario consistió de un aumento de 8% a pagar en dos tramos (4% en octubre y 4% en noviembre), el cual alcanzó también al personal de la Policía y el Servicio Penitenciario Bonaerense (SPB).",https://eleditorplatense.com/pol%C3%ADtica/1/2024/12/17/provincia-recibe-a-los-gremios-para-discutir-la-ultima-mejora-salarial-del-ano
Las ventas minoristas volvieron a caer en noviembre,2024-12-08,"Las ventas minoristas pymes bajaron 1,7% interanual en noviembre, a precios constantes, y acumulan un descenso de 12,2% en los primeros once meses del año, según un relevamiento dado a conocer hoy por la Confederación Argentina de la Mediana Empresa (CAME). En tanto, en la comparación mensual desestacionalizada arrojaron un dato positivo ya que crecieron 3,9%, 
De acuerdo a las cifras publicadas y la evolución económica,  el 2024 tendría un cierre con niveles similares o superiores a los del año anterior. Según testimonios de los comerciantes de distintos rubros de la economía, algunos proveedores subieron precios y, en base a tal aumento debieron incorporar promociones que les permitieron mantener la estabilidad. 
Respecto a los movimientos particulares de cada rubro, el de Perfumería fue el que más se vio afectado cayendo en 15,4%. Luego, viene Farmacias (-10,4%) y Bazar, decoración, textiles de hogar (-9,4%). Por el contrario, Alimentos y bebidas subieron en un 4,4% al igual que Calzado y Marroquinería que ascendieron en 2,6%.
El caso alimentos
La suba interanual en ventas fue del 4,4% para el mes de noviembre con precios constantes, aunque acumulan una baja del 14,5% en el resto del año en comparación al mismo periodo del 2023. La comparación intermensual fue de 0,1% por encima de octubre.
Si bien preocupa en el rubro el incremento de precios en la carne los últimos siete días del mes, el sector dio señales de satisfacción por el comportamiento en noviembre. La incertidumbre se mantiene respecto de lo que sucederá con las ventas durante las fiestas de fin de año, sumado a la venta informal que inquieta debido a que los comercios reportaron un incremento inusitado en la actividad.",https://eleditorplatense.com/econom%C3%ADa/1/2024/12/08/las-ventas-minoristas-volvieron-a-caer-en-noviembre
"Previo a la Navidad, cortarán el pelo gratis a jubilados en La Plata",2024-12-18,"Todo sucederá el próximo lunes 23 de diciembre por la mañana, en la esquina de 9 y 58, una peluquería ""social"" quien abrirá sus puertas nuevamente para quienes más lo necesitan.
Ofrecerán cortes gratuitos para jubilados que muestren su carnet. Pero esto no es lo único: también entregan mercadería para los mayores que lo necesiten.
En declaraciones que hicieron en exclusiva a este medio, contaron: “Este lunes 23 de diciembre a partir de las nueve de la mañana vamos a festejar la navidad con todos los abuelos en la barbería social de la Fundación Argentina Barberos Solidarios. Pondremos más de 25 barberos y Manicuras para atender a los abuelos y abuelas y festejar la navidad"". 
“Habrá corte gratis a jubilados y vamos a dar verduras y hortalizas de la mano del banco de Alimentos de La Plata y cajas navideñas donados por la Municipalidad de La Plata a través de la subsecretaría de desarrollo Social a cargo de Fabiana De Tomas”.
Cabe resaltar que en el local ubicado a pocos metros de Plaza Rocha, ofrece descuentos para trabajadores de menores ingresos, desde docentes hasta empleados municipales, incluso policías. La filosofía de esta peluquería es sencilla: “si la situación está complicada, al menos que el corte de pelo no sea un lujo inalcanzable”.",https://eleditorplatense.com/la%20regi%C3%B3n/17/2024/12/18/previo-a-la-navidad-cortaran-el-pelo-gratis-a-jubilados-en-la-plata
